{
  "schema_version": "phase2_contract_review.v1",
  "decision": "approved",
  "reviewer": "liuql",
  "reviewed_at": "2026-07-31T08:54:16Z",
  "git_object_format": "sha1",
  "preflight_release_id": "phase2-promotion-v5-2687c53",
  "preflight_release_source_commit": "2687c534f659e9c2381a961180605b86a1886ac9",
  "plan_sha256": "042f4c0ce1229b2043b8d397b3aa44feb49d128b5a8320ae4496b30425be6e5c",
  "blueprint_sha256": "6e7074258220bb4e08d522f2031d45cc9e152fc5fee0a257e40640c43c13bb98",
  "research_authority_sha256": "8dca1748a211b9eaf9df5d392d7d39d755cbe3946a358c11cff2f51c5323d91d",
  "review_schema_sha256": "cbf009b320d583772a62ba569718d1f61e24c0173a8d6f7e1b9c55314629ed9f",
  "contract_decisions_sha256": "87765515a29eb4b051ec9b67c0c64c7885832d6812af48a3db5af9dc8705da11",
  "schema_inventory_sha256": "0b836a9c48d4caefa98b0e06b624602ce0464de27c27676d5db3a0502269fae7",
  "approved_architecture_decisions": [
    "Use the reviewed Git-installed runtime release phase2-promotion-v5-2687c53 at source commit 2687c534f659e9c2381a961180605b86a1886ac9.",
    "Treat the same Linux user and control-plane account as trusted authority; malicious same-user swap-and-restore during recomputation is outside the threat model.",
    "Fail closed for ordinary authority drift, missing or extra files, symlinks, special files, path escape, size drift, mode drift, and content drift.",
    "Allow host network sharing only for registered real provider launches whose immutable protocol declares provider_access.",
    "Keep canary probes and trusted evaluator execution network isolated and omit provider credentials from evaluator execution.",
    "Mount only the selected Codex 0.145.0 binary, bounded authentication file, sanitized configuration, required system runtime paths, DNS files, and TLS certificates.",
    "Bind the live protocol to model gpt-5.6-sol, medium reasoning, a 600000-token global budget, a 7200-second wall-time budget, and one in-flight provider invocation.",
    "Run P2-08 before P2-09 and P2-10, and require exact current epoch-bound operator authorization before P2-09 may launch any provider.",
    "Use the preregistered deterministic L1 taskpack only in agentteam_direct mode and keep it unavailable to agentteam_full mode.",
    "Use the canonical python3 taskpack verification command while retaining the absolute Python executable in the immutable experiment acceptance argv.",
    "Do not automatically merge to main or push; P2-10 may only create the reviewed finalization child commit after accepted live evidence and full verification."
  ],
  "resolved_contradictions": [
    "Resolved provider reachability versus evaluator isolation by sharing host network only in the provider launch builder while forcing the probe and evaluator builders to remain unshared.",
    "Resolved real Codex binary size versus mount identity bounds by hashing bounded runtime files in streaming form with pre-open, descriptor, and post-read identity checks.",
    "Resolved late authority generation versus frozen taskpack immutability by snapshotting project-work-root authority during materialization and covering snapshots with the frozen digest.",
    "Resolved taskpack goal classification and command allowlisting by using implementation-explicit goal text and the canonical python3 verification executable without changing live protocol acceptance authority.",
    "Separated governance commits from evaluated implementation by binding the candidate release and live protocol to commit 2687c53 while requiring that commit to remain an ancestor of the tracked promotion contract."
  ],
  "remaining_escalations": [],
  "notes": "Supersedes review.v1 only for the repaired materialization contract. It approves freezing P2-08 through P2-10 but does not provide the separate epoch-bound P2-09 live-provider authorization and does not authorize main merge or push."
}
