{
  "schema_version": "phase2_contract_review.v1",
  "decision": "approved",
  "reviewer": "liuql",
  "reviewed_at": "2026-08-03T08:42:37Z",
  "git_object_format": "sha1",
  "preflight_release_id": "phase2-promotion-v9-0de16d0",
  "preflight_release_source_commit": "0de16d0f425c3039e6a23c12c345233933274a9a",
  "plan_sha256": "042f4c0ce1229b2043b8d397b3aa44feb49d128b5a8320ae4496b30425be6e5c",
  "blueprint_sha256": "0903134a1a52e698d68de675bf90372194389998295cab5c5244a4927b7005b0",
  "research_authority_sha256": "8dca1748a211b9eaf9df5d392d7d39d755cbe3946a358c11cff2f51c5323d91d",
  "review_schema_sha256": "cbf009b320d583772a62ba569718d1f61e24c0173a8d6f7e1b9c55314629ed9f",
  "contract_decisions_sha256": "beacb6615e0c2da12239338140f21e4634403aeadc50b1e7ef9d5d14892bd599",
  "schema_inventory_sha256": "0b836a9c48d4caefa98b0e06b624602ce0464de27c27676d5db3a0502269fae7",
  "approved_architecture_decisions": [
    "Use the reviewed Git-installed runtime release phase2-promotion-v9-0de16d0 at source commit 0de16d0f425c3039e6a23c12c345233933274a9a.",
    "Treat the same Linux user and control-plane account as trusted authority; malicious same-user swap-and-restore during recomputation is outside the threat model.",
    "Fail closed for ordinary authority drift, missing or extra files, symlinks, special files, path escape, size drift, mode drift, and content drift.",
    "Allow host network sharing only for registered real provider launches whose immutable protocol declares provider_access.",
    "Inject only credential-free numeric-loopback HTTP proxy URLs into provider launches; remove all proxy variables from canary probes and trusted evaluator execution.",
    "Do not inherit the outer AGENTTEAM_LAUNCHER_SELECTION when direct or full experiment adapters launch their nested runtime.",
    "Persist the experiment run ID, run-manifest digest, target-path digest, and controller reference in scheduler state so operator stop validates against the real ledger.",
    "Derive a controller-only run's initial integration baseline from the frozen taskpack runtime release source commit unless the caller supplies an explicit baseline.",
    "Mount only the selected Codex 0.145.0 binary, bounded authentication file, sanitized configuration, required system runtime paths, DNS files, and TLS certificates.",
    "Bind the live protocol to model gpt-5.6-sol, medium reasoning, a 600000-token global budget, a 7200-second wall-time budget, and one in-flight provider invocation.",
    "Run P2-08 before P2-09 and P2-10, and require exact current epoch-bound operator authorization before P2-09 may launch any provider.",
    "Use the preregistered deterministic L1 taskpack only in agentteam_direct mode and keep it unavailable to agentteam_full mode.",
    "Do not automatically merge to main or push; P2-10 may only create the reviewed finalization child commit after accepted live evidence and full verification."
  ],
  "resolved_contradictions": [
    "Resolved the v7 nested-runtime failure by making launcher-selection inheritance explicit and disabled for experiment adapters.",
    "Resolved experiment stop rejection by deriving and persisting the exact target-run binding from the validated experiment runtime context.",
    "Resolved provider reachability versus evaluator isolation by allowing a credential-free loopback proxy only in network-enabled provider launches while stripping proxy variables from probes and evaluators.",
    "Regenerated deterministic calibration evidence against 0de16d0 instead of reusing the v8 runtime identity.",
    "Resolved the v8 startup failure by deriving the controller-only integration baseline from the frozen taskpack candidate release binding.",
    "Preserved the failed v8 run as forensic evidence and requires a fresh v9 taskpack, run identity, epoch, and P2-09 authorization."
  ],
  "remaining_escalations": [],
  "notes": "Approved v9 repair contract. This approval authorizes taskpack materialization and freezing only; it does not authorize P2-09 provider access, main merge, or push."
}
