{
  "schema_version": "phase2_contract_review.v1",
  "decision": "pending",
  "reviewer": "pending-operator",
  "reviewed_at": "2026-08-05T07:50:20Z",
  "git_object_format": "sha1",
  "preflight_release_id": "phase2-promotion-v19-c3dceb9-git",
  "preflight_release_source_commit": "c3dceb952b746458d24a3f2c12f58f7394f2e646",
  "plan_sha256": "1e81db69f9685272f1772ea07a52631a8edc0f83bcf96f2f2713a2c2e21a54a8",
  "blueprint_sha256": "2798dba180e7f52773827afaf610e6748c72ec6768dbf803512149c017895db3",
  "research_authority_sha256": "8dca1748a211b9eaf9df5d392d7d39d755cbe3946a358c11cff2f51c5323d91d",
  "review_schema_sha256": "cbf009b320d583772a62ba569718d1f61e24c0173a8d6f7e1b9c55314629ed9f",
  "contract_decisions_sha256": "a47ebb3cd5f8eb005c21adaf6f6b536cbcc06c5f378e2890969a9674b9b40b7a",
  "schema_inventory_sha256": "c9bc3c1b5396e58f4bf83d1cc08054570795206a845f9c92cf25ff923fdc0c76",
  "approved_architecture_decisions": [
    "Use the reviewed Git-installed runtime release phase2-promotion-v19-c3dceb9-git at source commit c3dceb952b746458d24a3f2c12f58f7394f2e646.",
    "Treat the same Linux user and control-plane account as trusted authority; malicious same-user swap-and-restore during recomputation is outside the threat model.",
    "Fail closed for ordinary authority drift, missing or extra files, symlinks, special files, path escape, size drift, mode drift, and content drift.",
    "Allow host network sharing only for registered real provider launches whose immutable protocol declares provider_access.",
    "Inject only credential-free numeric-loopback HTTP proxy URLs into provider launches; remove all proxy variables from canary probes and trusted evaluator execution.",
    "Do not inherit the outer AGENTTEAM_LAUNCHER_SELECTION when direct or full experiment adapters launch their nested runtime.",
    "Persist the experiment run ID, run-manifest digest, target-path digest, and controller reference in scheduler state so operator stop validates against the real ledger.",
    "Derive a controller-only run's initial integration baseline from the frozen taskpack runtime release source commit unless the caller supplies an explicit baseline.",
    "Stage provider-readable repo and role context plus the provider result file inside the independent attempt workspace before sealing the sandbox source authority, while keeping those files outside the business Git diff.",
    "Give the normal worker outbox a bounded two-second publication-priority window after observing a provider terminal, while interrupted resume and lease-expired orphan recovery remain immediately recoverable and fail closed.",
    "Mount only the selected Codex 0.145.0 binary, bounded authentication file, sanitized configuration, required system runtime paths, DNS files, and TLS certificates.",
    "Bind the live protocol to model gpt-5.6-sol, medium reasoning, a 600000-token global budget, a 7200-second wall-time budget, and one in-flight provider invocation.",
    "Run P2-08 before P2-09 and P2-10, and require exact current epoch-bound operator authorization before P2-09 may launch any provider.",
    "Use the preregistered deterministic L1 taskpack only in agentteam_direct mode and keep it unavailable to agentteam_full mode.",
    "Do not automatically merge to main or push; P2-10 may only create the reviewed finalization child commit after accepted live evidence and full verification.",
    "Keep the P2-08 capability registry strict and fail closed; the approved blueprint declares registry version phase2_readiness_capability_registry.v1 and materialization generates the exact test IDs, Git artifact paths, and blob digests from the candidate source commit.",
    "Bind contract.protocol_sha256 to the canonical JSON digest of the resolved protocol template and reject mismatches during blueprint materialization before freezing or provider authorization.",
    "Do not publish pre-provider or post-integration boundary observations while an experiment attempt remains inflight; retry transient provider-lane lock contention for at most 250 milliseconds while retaining fail-closed denial for a genuinely occupied lane.",
    "Start both provider and evaluator source-guard Python processes with -B so live execution cannot add bytecode files to the immutable Git-installed runtime release.",
    "Keep a stable Python source-guard as the transient service main process, launch and wait for the sandbox command as its child, and retain KillMode=control-group so completion no longer depends on direct sandbox-main or empty-cgroup inotify observation while timeout, nonzero exit, and descendant cleanup still fail closed."
  ],
  "resolved_contradictions": [
    "Preserved the accepted fixed-registry generation, canonical protocol binding, sandbox, authority, budget, runtime-binding, provider-isolation, provider-lane, and worker-outbox mechanisms.",
    "Preserved v17 P2-08 as passed forensic evidence with zero provider calls and zero target mutations, but do not reuse it for the new release-bound gate chain.",
    "The explicitly authorized v17 P2-09 direct-mode provider invocation completed with 142699 model tokens and produced the correct one-file patch plus a complete worker semantic result.",
    "The v17 trusted evaluator executed the deterministic acceptance suite twice and both executions reported OK, but the outer transient-service path returned nonzero under exhausted host cgroup inotify resources and the controller correctly rejected promotion.",
    "Reproduced the host coupling: a sandbox command used directly as the systemd main process did not produce a reliable wait result on the exhausted host, while a stable Python parent that launched and waited for the same sandbox command completed reliably.",
    "Replaced source-guard exec handoff with bounded child-process observation; real systemd regressions pass for successful acceptance and detached-child cleanup while nonzero exit, timeout, isolation, leak, and evidence failures remain fail closed.",
    "Retained the doctor inotify warning as non-blocking host diagnostics rather than an experiment acceptance or promotion condition.",
    "Regenerated a clean Git-installed v18 candidate release plus deterministic calibration and promotion authority against source commit c3dceb9.",
    "The invalid first v18 deterministic authority attempt changed the protocol seed after sealing runs and was rejected by protocol binding; it is retained only as a failed-protocol-drift forensic directory and is excluded from this contract.",
    "The frozen v18 controller run launched zero provider calls and failed P2-08 because its report bound the canonical JSON digest of calibration-request.json while the gate contract requires the raw authority-file byte digest.",
    "The mismatch came from an operator-side helper script that called run_deterministic_experiment_calibration directly; the runtime controller and gate correctly failed closed and require no source-code change.",
    "Regenerated v19 calibration through run_deterministic_calibration_from_manifest, verified that report.calibration_request_sha256 equals the request file's raw SHA-256, and rebuilt fresh release, promotion authority, taskpack, and run identities.",
    "Requires a fresh v19 taskpack, run identity, gate epoch, P2-08 readiness result, and exact P2-09 provider authorization."
  ],
  "remaining_escalations": [
    "Operator must review and approve this exact v19 calibration-request binding repair contract before taskpack materialization or any new P2-09 provider launch."
  ],
  "notes": "Proposed v19 calibration-request raw-byte binding repair contract. Pending approval; it does not authorize taskpack materialization, P2-09 provider access, main merge, or push."
}
