{
  "schema_version": "phase2_contract_review.v1",
  "decision": "approved",
  "reviewer": "operator-delegate",
  "reviewed_at": "2026-08-05T09:10:46Z",
  "git_object_format": "sha1",
  "preflight_release_id": "phase2-promotion-v21-db49648-git",
  "preflight_release_source_commit": "db4964836efa4eb04ce763e48b61c8a78743ec6a",
  "plan_sha256": "9d656d0bfd090a4292c84b5719a631253402f943f3421d423923b265904cff63",
  "blueprint_sha256": "19e136a25964bc8a5ea0ff35aefb7cfc72a5d3189be3af6df2d8e1c7aef02f27",
  "research_authority_sha256": "8dca1748a211b9eaf9df5d392d7d39d755cbe3946a358c11cff2f51c5323d91d",
  "review_schema_sha256": "cbf009b320d583772a62ba569718d1f61e24c0173a8d6f7e1b9c55314629ed9f",
  "contract_decisions_sha256": "bae1e39cf3c27763e9d13ab35f5c0ddf7a4209ec33ef01ebf215ba20c5a544bd",
  "schema_inventory_sha256": "c9bc3c1b5396e58f4bf83d1cc08054570795206a845f9c92cf25ff923fdc0c76",
  "approved_architecture_decisions": [
    "Use the reviewed Git-installed runtime release phase2-promotion-v21-db49648-git at source commit db4964836efa4eb04ce763e48b61c8a78743ec6a.",
    "Treat the same Linux user and control-plane account as trusted authority; malicious same-user swap-and-restore during recomputation is outside the threat model.",
    "Fail closed for ordinary authority drift, missing or extra files, symlinks, special files, path escape, size drift, mode drift, and content drift.",
    "Allow host network sharing only for registered real provider launches whose immutable protocol declares provider_access.",
    "Inject only credential-free numeric-loopback HTTP proxy URLs into provider launches; remove all proxy variables from canary probes and trusted evaluator execution.",
    "Do not inherit the outer AGENTTEAM_LAUNCHER_SELECTION when direct or full experiment adapters launch their nested runtime.",
    "Persist the experiment run ID, run-manifest digest, target-path digest, and controller reference in scheduler state so operator stop validates against the real ledger.",
    "Derive a controller-only run's initial integration baseline from the frozen taskpack runtime release source commit unless the caller supplies an explicit baseline.",
    "Stage provider-readable repo and role context plus the provider result file inside the independent attempt workspace before sealing the sandbox source authority, while keeping those files outside the business Git diff.",
    "Give the normal worker outbox a bounded two-second publication-priority window after observing a provider terminal, while interrupted resume and lease-expired orphan recovery remain immediately recoverable and fail closed.",
    "Mount only the selected Codex 0.145.0 binary, bounded authentication file, sanitized configuration, required system runtime paths, DNS files, and TLS certificates.",
    "Bind the live protocol to model gpt-5.6-sol, medium reasoning, a 600000-token global budget, a 7200-second wall-time budget, and one in-flight provider invocation.",
    "Run P2-08 before P2-09 and P2-10, and require exact current epoch-bound operator authorization before P2-09 may launch any provider.",
    "Use the preregistered deterministic L1 taskpack only in agentteam_direct mode and keep it unavailable to agentteam_full mode.",
    "Do not automatically merge to main or push; P2-10 may only create the reviewed finalization child commit after accepted live evidence and full verification.",
    "Keep the P2-08 capability registry strict and fail closed; the approved blueprint declares registry version phase2_readiness_capability_registry.v1 and materialization generates the exact test IDs, Git artifact paths, and blob digests from the candidate source commit.",
    "Bind contract.protocol_sha256 to the canonical JSON digest of the resolved protocol template and reject mismatches during blueprint materialization before freezing or provider authorization.",
    "Do not publish pre-provider or post-integration boundary observations while an experiment attempt remains inflight; retry transient provider-lane lock contention for at most 250 milliseconds while retaining fail-closed denial for a genuinely occupied lane.",
    "Start both provider and evaluator source-guard Python processes with -B so live execution cannot add bytecode files to the immutable Git-installed runtime release.",
    "Keep a stable Python source-guard as the transient service main process, launch and wait for the sandbox command as its child, and retain KillMode=control-group so completion no longer depends on direct sandbox-main or empty-cgroup inotify observation while timeout, nonzero exit, and descendant cleanup still fail closed.",
    "Use the immutable protocol acceptance argv for final integration verification in both AgentTeam modes; permit the trusted override only with the controller-bound target project root, while ordinary taskpacks retain their own verification command."
  ],
  "resolved_contradictions": [
    "Preserved the accepted fixed-registry generation, canonical protocol binding, sandbox, authority, budget, runtime-binding, provider-isolation, provider-lane, and worker-outbox mechanisms.",
    "Preserved v17 P2-08 as passed forensic evidence with zero provider calls and zero target mutations, but do not reuse it for the new release-bound gate chain.",
    "The explicitly authorized v17 P2-09 direct-mode provider invocation completed with 142699 model tokens and produced the correct one-file patch plus a complete worker semantic result.",
    "The v17 trusted evaluator executed the deterministic acceptance suite twice and both executions reported OK, but the outer transient-service path returned nonzero under exhausted host cgroup inotify resources and the controller correctly rejected promotion.",
    "Reproduced the host coupling: a sandbox command used directly as the systemd main process did not produce a reliable wait result on the exhausted host, while a stable Python parent that launched and waited for the same sandbox command completed reliably.",
    "Replaced source-guard exec handoff with bounded child-process observation; real systemd regressions pass for successful acceptance and detached-child cleanup while nonzero exit, timeout, isolation, leak, and evidence failures remain fail closed.",
    "Retained the doctor inotify warning as non-blocking host diagnostics rather than an experiment acceptance or promotion condition.",
    "Regenerated a clean Git-installed v18 candidate release plus deterministic calibration and promotion authority against source commit db49648.",
    "The invalid first v18 deterministic authority attempt changed the protocol seed after sealing runs and was rejected by protocol binding; it is retained only as a failed-protocol-drift forensic directory and is excluded from this contract.",
    "The frozen v18 controller run launched zero provider calls and failed P2-08 because its report bound the canonical JSON digest of calibration-request.json while the gate contract requires the raw authority-file byte digest.",
    "The mismatch came from an operator-side helper script that called run_deterministic_experiment_calibration directly; the runtime controller and gate correctly failed closed and require no source-code change.",
    "Regenerated v19 calibration through run_deterministic_calibration_from_manifest, verified that report.calibration_request_sha256 equals the request file's raw SHA-256, and rebuilt fresh release, promotion authority, taskpack, and run identities.",
    "The v19 P2-08 gate passed with zero provider calls and zero target mutations, but P2-09 rejected the protocol before provider launch because seed 19 retained the mode order derived for seed 17.",
    "Generated the v20 mode order with the runtime's seeded ordering function, verified that the protocol order equals the seed-derived order, and regenerated fresh calibration, release, promotion authority, taskpack, run, epoch, and authorization identities.",
    "Preserved the v20 P2-08 pass as immutable forensic evidence with zero provider calls and zero target mutations; it is not reused for v21.",
    "The authorized v20 P2-09 agentteam_full mode used 289069 model tokens across taskpack authoring and implementation, produced the correct one-file counter patch, and passed the worker-focused test.",
    "v20 then failed closed because final integration ran the model-authored taskpack verification from the repository root instead of the immutable protocol acceptance argv, rolled back the accepted patch, and therefore failed common evaluation.",
    "Bound both AgentTeam experiment adapters to the protocol acceptance argv through a trusted project-root-scoped runtime override; ordinary taskpack verification behavior is unchanged.",
    "The focused taskpack and adapter regressions passed, and the complete runtime suite passed 957 tests with 4 skips at source commit db49648.",
    "Generated fresh v21 deterministic calibration through run_deterministic_calibration_from_manifest, verified its raw request-file binding, and derived protocol mode order through the seeded runtime function.",
    "Requires a fresh v21 taskpack, run identity, gate epoch, P2-08 readiness result, and exact P2-09 provider authorization."
  ],
  "remaining_escalations": [],
  "notes": "Approved under the operator's delegated iteration authority for the v21 protocol-owned integration-verification repair. This authorizes taskpack materialization, freezing, deterministic P2-08, and a separately recorded exact current epoch-bound P2-09 authorization within the unchanged model, token, wall-time, and concurrency limits; no gate may merge to main or push."
}
