{
  "schema_version": "phase2_contract_review.v1",
  "decision": "approved",
  "reviewer": "liuql",
  "reviewed_at": "2026-07-29T19:39:14+08:00",
  "git_object_format": "sha1",
  "preflight_release_id": "artifact-handoff-e4d524f",
  "preflight_release_source_commit": "e4d524fd4420ca1a88e6c125b721850c2b241d69",
  "plan_sha256": "5facb4d6d0e535b109207dd011c4dccf97d93a41acf5ccfc326163c2d3e34cd1",
  "blueprint_sha256": "1adaef2e48ba9a110b203520006977b60accf00869dd620bdb19cfbb5ce99e9e",
  "research_authority_sha256": "8dca1748a211b9eaf9df5d392d7d39d755cbe3946a358c11cff2f51c5323d91d",
  "review_schema_sha256": "cbf009b320d583772a62ba569718d1f61e24c0173a8d6f7e1b9c55314629ed9f",
  "contract_decisions_sha256": "33114852157b049a43fcf8a99f9d61d7a6301879498f917bcdfdecc9ddef9355",
  "schema_inventory_sha256": "1a1fbd1c7de6de918d28be4ca21161b6723a801ddc001b0c5f6dfcfd5330ef64",
  "approved_architecture_decisions": [
    "Use immutable experiment protocols and per-run manifests with stable-request idempotency.",
    "Use one protocol-global cross-run provider lease and one model/reasoning profile for initial comparisons.",
    "Give single_codex only the original task contract and direct access to an independently sanitized repository.",
    "Use independent Git object stores plus bwrap canary enforcement for clean reset and blind-gold isolation.",
    "Enforce token and wall-time budgets only at provider and integration safe boundaries with visible one-call overshoot.",
    "Keep recovery snapshots separate from fsynced, atomically published, immutable terminal result bundles.",
    "Store operator actions in an append-only closed-vocabulary ledger and require epoch-bound live authorization.",
    "Require deterministic calibration to retain completed, failed, infrastructure_failed, interrupted, and budget_stopped result bundles.",
    "Require P2-08 to parse the canonical deterministic calibration report and bind it to the validated code commit.",
    "Complete the zero-call pilot guard before journaling the complete P2-08 action and registering it against the refreshed R epoch.",
    "Bind blueprint materialization to the active compatible artifact-handoff runtime release."
  ],
  "resolved_contradictions": [
    "Preserved the approved v2 review as immutable history after executable materialization rejected its stale and unavailable p2-preflight-26ed244 release identity.",
    "Rebound the unchanged repaired capability contract to active release artifact-handoff-e4d524f at ancestor commit e4d524fd4420ca1a88e6c125b721850c2b241d69.",
    "Corrected the P2-06 exact write-scope cardinality from 13 to 14.",
    "Replaced digest-only deterministic calibration acceptance with canonical report validation and source-commit binding.",
    "Expanded readiness recomputation to cover budget warning, exhaustion, overshoot, accepted-patch preservation, operator input normalization, recovery snapshots, and result projection.",
    "Required deterministic calibration to retain every terminal outcome named by the Phase 2 capability-promotion contract.",
    "Aligned the P2-08 document order with the recoverable implementation by completing the pilot guard before publishing the action journal, refreshed epoch, and receipt.",
    "Separated deterministic unit calibration from the dedicated real-systemd integration tests so ordinary verification does not hang on transient-service availability."
  ],
  "remaining_escalations": [],
  "notes": "Operator-approved replacement for review.v2. Capability semantics are unchanged; v3 repairs only the executable active-release binding and the plan status that records the v2 materialization failure."
}
