{
  "schema_version": "phase2_contract_review.v1",
  "decision": "approved",
  "reviewer": "liuql",
  "reviewed_at": "2026-07-29T19:29:36+08:00",
  "git_object_format": "sha1",
  "preflight_release_id": "p2-preflight-26ed244",
  "preflight_release_source_commit": "26ed2442bb850268748bb53c168ebcc2dea0cc62",
  "plan_sha256": "f3784c6b9e3c3524327b07ba6526a76b1b50695d61aefea57f9b5d8fb50894e3",
  "blueprint_sha256": "796a77d3da41c219350f1a5cee6b88cd562a0ff88c220b65d840b86d75572d79",
  "research_authority_sha256": "8dca1748a211b9eaf9df5d392d7d39d755cbe3946a358c11cff2f51c5323d91d",
  "review_schema_sha256": "cbf009b320d583772a62ba569718d1f61e24c0173a8d6f7e1b9c55314629ed9f",
  "contract_decisions_sha256": "33114852157b049a43fcf8a99f9d61d7a6301879498f917bcdfdecc9ddef9355",
  "schema_inventory_sha256": "1a1fbd1c7de6de918d28be4ca21161b6723a801ddc001b0c5f6dfcfd5330ef64",
  "approved_architecture_decisions": [
    "Use immutable experiment protocols and per-run manifests with stable-request idempotency.",
    "Use one protocol-global cross-run provider lease and one model/reasoning profile for initial comparisons.",
    "Give single_codex only the original task contract and direct access to an independently sanitized repository.",
    "Use independent Git object stores plus bwrap canary enforcement for clean reset and blind-gold isolation.",
    "Enforce token and wall-time budgets only at provider and integration safe boundaries with visible one-call overshoot.",
    "Keep recovery snapshots separate from fsynced, atomically published, immutable terminal result bundles.",
    "Store operator actions in an append-only closed-vocabulary ledger and require epoch-bound live authorization.",
    "Require deterministic calibration to retain completed, failed, infrastructure_failed, interrupted, and budget_stopped result bundles.",
    "Require P2-08 to parse the canonical deterministic calibration report and bind it to the validated code commit.",
    "Complete the zero-call pilot guard before journaling the complete P2-08 action and registering it against the refreshed R epoch.",
    "Complete the implementation taskpack under the preflight release, then install the reviewed candidate release before freezing a controller-only promotion taskpack."
  ],
  "resolved_contradictions": [
    "Corrected the P2-06 exact write-scope cardinality from 13 to 14.",
    "Replaced digest-only deterministic calibration acceptance with canonical report validation and source-commit binding.",
    "Expanded readiness recomputation to cover budget warning, exhaustion, overshoot, accepted-patch preservation, operator input normalization, recovery snapshots, and result projection.",
    "Required deterministic calibration to retain every terminal outcome named by the Phase 2 capability-promotion contract.",
    "Aligned the P2-08 document order with the recoverable implementation by completing the pilot guard before publishing the action journal, refreshed epoch, and receipt.",
    "Separated deterministic unit calibration from the dedicated real-systemd integration tests so ordinary verification does not hang on transient-service availability."
  ],
  "remaining_escalations": [],
  "notes": "Operator-approved immutable replacement for review.v1. The historical review remains unchanged because it binds earlier plan and blueprint bytes."
}
