{
  "schema_version": "phase2_contract_review.v1",
  "decision": "approved",
  "reviewer": "liuql",
  "reviewed_at": "2026-07-30T11:07:22+08:00",
  "git_object_format": "sha1",
  "preflight_release_id": "phase2-cleanup-recovery-5a06f6c",
  "preflight_release_source_commit": "5a06f6c9c2a2e54444a315e54feb1651d4fdd63d",
  "plan_sha256": "60a7a29154c7ee8180d898d37ade1b7a8a69911b6daf6b86a522e49703537d09",
  "blueprint_sha256": "df7e12b65b64c87d89691e13293f4c9fc4a99fdc565ede31576f2e05b3f2c751",
  "research_authority_sha256": "8dca1748a211b9eaf9df5d392d7d39d755cbe3946a358c11cff2f51c5323d91d",
  "review_schema_sha256": "cbf009b320d583772a62ba569718d1f61e24c0173a8d6f7e1b9c55314629ed9f",
  "contract_decisions_sha256": "f54d410006f34b75d2a102e9d9c88cf5e80a83b4e394812ab0e068aa2398f86a",
  "schema_inventory_sha256": "c5ffc8dc6a609e362fa37d9c5248427d48b2062baa1445364bf8d125b1acf629",
  "approved_architecture_decisions": [
    "Retain the Phase 2 v4 requirement that terminal result authority is sealed and validated before disposable snapshot cleanup.",
    "Separate strict live sandbox mount validation from digest-bound historical replay validation after cleanup.",
    "Permit historical replay only from immutable invocation and sandbox authorities already bound to the sealed terminal result.",
    "Keep prelaunch and live provider paths fail-closed when any required mount source is missing.",
    "Treat cleanup receipt evidence as separate immutable authority and derive projection status from that receipt.",
    "Start recovery from the verified P2-05R prefix and exclude both rejected P2-05C attempt patches from the new baseline.",
    "Keep P2-08, live calibration, source merge, push, and candidate promotion outside this taskpack."
  ],
  "resolved_contradictions": [
    "Removed the contradiction between mandatory snapshot deletion and calibration requiring that deleted path to remain live.",
    "Bound newly added runtime resources into Git inventory before integration verification through release phase2-cleanup-recovery-5a06f6c.",
    "Replaced broad blind retry with one task whose acceptance tests include the exact five failures observed in both P2-05C attempts."
  ],
  "remaining_escalations": [],
  "notes": "Approved as a narrow recovery within the already approved Phase 2 v4 scope. It authorizes only P2-05C-R and does not authorize P2-08, live provider calibration, source merge, push, or release promotion."
}
