{
  "schema_version": "phase2_contract_review.v1",
  "decision": "approved",
  "reviewer": "liuql",
  "reviewed_at": "2026-07-27T18:27:48+08:00",
  "git_object_format": "sha1",
  "preflight_release_id": "p2-preflight-26ed244",
  "preflight_release_source_commit": "26ed2442bb850268748bb53c168ebcc2dea0cc62",
  "plan_sha256": "27ce8dbc2920d1f539c25010358c355c454fb04f8dbb4995cba2494f9a8f40c2",
  "blueprint_sha256": "89a251a05557ada6436dbe602850464c393ac6c65131f77bce5636fb16d6c677",
  "research_authority_sha256": "8dca1748a211b9eaf9df5d392d7d39d755cbe3946a358c11cff2f51c5323d91d",
  "review_schema_sha256": "cbf009b320d583772a62ba569718d1f61e24c0173a8d6f7e1b9c55314629ed9f",
  "contract_decisions_sha256": "dd5b34f3e0a470b0344a1d63ff5af6570bcf4022a76b348c6d56828b3ccedd91",
  "schema_inventory_sha256": "b43260b1dab04d2219e53c844e83e204542e3d7f9a21c3652c62bdb1d7bdecd5",
  "approved_architecture_decisions": [
    "Use immutable experiment protocols and per-run manifests with stable-request idempotency.",
    "Use one protocol-global cross-run provider lease and one model/reasoning profile for initial comparisons.",
    "Give single_codex only the original task contract and direct access to an independently sanitized repository.",
    "Use independent Git object stores plus bwrap canary enforcement for clean reset and blind-gold isolation.",
    "Enforce token and wall-time budgets only at provider and integration safe boundaries with visible one-call overshoot.",
    "Keep recovery snapshots separate from fsynced, atomically published, immutable terminal result bundles.",
    "Store operator actions in an append-only closed-vocabulary ledger and require epoch-bound live authorization.",
    "Integrate one tracked repo-map handoff for L2 workers rather than relying on excluded .agentteam paths.",
    "Complete the implementation taskpack under the preflight release, then install the reviewed candidate release before freezing a controller-only promotion taskpack.",
    "Require dedicated relation validators to recompute readiness, calibration, authorization, and final-report Git relations."
  ],
  "resolved_contradictions": [
    "Separated recoverable interruption snapshots from terminal interrupted result bundles.",
    "Replaced run-local provider concurrency with a protocol-global cross-run lease.",
    "Removed AgentTeam repo-map context from the single_codex comparison mode.",
    "Replaced an in-place runtime hot-load assumption with a reviewed candidate-release handoff.",
    "Moved the repo-map handoff from excluded .agentteam state into a tracked implementation artifact.",
    "Bound the Phase 1 promotion to the recorded remote default head instead of a mutable local remote-tracking ref.",
    "Split implementation and promotion into separately frozen taskpacks so new gate code executes only under the candidate release."
  ],
  "remaining_escalations": [],
  "notes": "Two independent final reviews found no blocker or major issue. The full native runtime suite passed 721 tests. The preflight release includes the approved materializer, tracked repo-map handoff compatibility, absolute provider executable resolution for systemd, and canonical projection handling for source metadata."
}
