{
  "schema_version": "phase2_contract_review.v1",
  "decision": "approved",
  "reviewer": "liuql",
  "reviewed_at": "2026-07-30T12:14:11+08:00",
  "git_object_format": "sha1",
  "preflight_release_id": "phase2-remainder-27a544c",
  "preflight_release_source_commit": "27a544c3dc6cfdf3746eda1a94dfa83be84d5ae0",
  "plan_sha256": "60a7a29154c7ee8180d898d37ade1b7a8a69911b6daf6b86a522e49703537d09",
  "blueprint_sha256": "0d1b927dd067296c9a42020f911e44170e71503bcadd034ef9eb721c3972614a",
  "research_authority_sha256": "8dca1748a211b9eaf9df5d392d7d39d755cbe3946a358c11cff2f51c5323d91d",
  "review_schema_sha256": "cbf009b320d583772a62ba569718d1f61e24c0173a8d6f7e1b9c55314629ed9f",
  "contract_decisions_sha256": "302be384bbe8d74f5d2feaa3e20f75bff7e484978e50ce4e228481499182df50",
  "schema_inventory_sha256": "d00ccf4e5254b0e822e34a0fa4433575a44f4dea77cd60f254132f5fedce73f9",
  "approved_architecture_decisions": [
    "Continue from the verified cleanup-recovery source and retain the accepted P2-04R through P2-05C-R implementation.",
    "Execute one bounded repository-map refresh before the remaining L2 implementation tasks.",
    "Require all three modes to consume one immutable protocol and reach one evaluator, finalizer, and cleanup path.",
    "Require every live launch to revalidate mutable source identity at the final launch boundary.",
    "Remove the public ability to disable required namespace-denial evidence while keeping any probe-only path private.",
    "Keep historical replay private, digest-bound, receipt-bound, and unavailable to live launch callers.",
    "Require deterministic provider-free calibration to retain equal-input, usage, isolation, cleanup, outcome, replay, and projection evidence.",
    "Require gate controllers to recompute relations and current authorization instead of trusting schema-valid declarations.",
    "Keep P2-08, live calibration, candidate release activation, main-branch merge, and push outside this taskpack."
  ],
  "resolved_contradictions": [
    "Assigned the launch-source TOCTOU and namespace-evidence downgrade findings to P2-06R instead of reopening the completed cleanup task.",
    "Preserved strict live validation while allowing only sealed historical evidence to survive disposable snapshot deletion.",
    "Separated deterministic calibration and gate preparation from the independently approved P2-08 promotion action."
  ],
  "remaining_escalations": [],
  "notes": "Approved derived execution contract for P2-06R through P2-07B-R. It authorizes a verified integration baseline only and does not authorize P2-08, live provider calls, release promotion, main-branch merge, or push."
}
