{
  "schema_version": "phase2_contract_review.v1",
  "decision": "pending",
  "reviewer": "pending-operator",
  "reviewed_at": "2026-08-04T04:07:23Z",
  "git_object_format": "sha1",
  "preflight_release_id": "phase2-promotion-v13-9ff06d8",
  "preflight_release_source_commit": "9ff06d895683359cefd62cdd8c4076052d21403c",
  "plan_sha256": "042f4c0ce1229b2043b8d397b3aa44feb49d128b5a8320ae4496b30425be6e5c",
  "blueprint_sha256": "437343ae6af688a62fd8d18e4da34daecda933019540b87b9b143450dc6979e3",
  "research_authority_sha256": "8dca1748a211b9eaf9df5d392d7d39d755cbe3946a358c11cff2f51c5323d91d",
  "review_schema_sha256": "cbf009b320d583772a62ba569718d1f61e24c0173a8d6f7e1b9c55314629ed9f",
  "contract_decisions_sha256": "ad90474158e091d6372d9b81bbe31768bedc8b3001f012fecd7247b99d56708c",
  "schema_inventory_sha256": "c9bc3c1b5396e58f4bf83d1cc08054570795206a845f9c92cf25ff923fdc0c76",
  "approved_architecture_decisions": [
    "Use the reviewed Git-installed runtime release phase2-promotion-v13-9ff06d8 at source commit 9ff06d895683359cefd62cdd8c4076052d21403c.",
    "Treat the same Linux user and control-plane account as trusted authority; malicious same-user swap-and-restore during recomputation is outside the threat model.",
    "Fail closed for ordinary authority drift, missing or extra files, symlinks, special files, path escape, size drift, mode drift, and content drift.",
    "Allow host network sharing only for registered real provider launches whose immutable protocol declares provider_access.",
    "Inject only credential-free numeric-loopback HTTP proxy URLs into provider launches; remove all proxy variables from canary probes and trusted evaluator execution.",
    "Do not inherit the outer AGENTTEAM_LAUNCHER_SELECTION when direct or full experiment adapters launch their nested runtime.",
    "Persist the experiment run ID, run-manifest digest, target-path digest, and controller reference in scheduler state so operator stop validates against the real ledger.",
    "Derive a controller-only run's initial integration baseline from the frozen taskpack runtime release source commit unless the caller supplies an explicit baseline.",
    "Stage provider-readable repo and role context plus the provider result file inside the independent attempt workspace before sealing the sandbox source authority, while keeping those files outside the business Git diff.",
    "Give the normal worker outbox one scheduler tick of publication priority after observing a provider terminal, then retain bounded terminal-only orphan recovery on the following tick.",
    "Mount only the selected Codex 0.145.0 binary, bounded authentication file, sanitized configuration, required system runtime paths, DNS files, and TLS certificates.",
    "Bind the live protocol to model gpt-5.6-sol, medium reasoning, a 600000-token global budget, a 7200-second wall-time budget, and one in-flight provider invocation.",
    "Run P2-08 before P2-09 and P2-10, and require exact current epoch-bound operator authorization before P2-09 may launch any provider.",
    "Use the preregistered deterministic L1 taskpack only in agentteam_direct mode and keep it unavailable to agentteam_full mode.",
    "Do not automatically merge to main or push; P2-10 may only create the reviewed finalization child commit after accepted live evidence and full verification.",
    "Keep the P2-08 capability registry strict and fail closed; the approved blueprint declares registry version phase2_readiness_capability_registry.v1 and materialization generates the exact test IDs, Git artifact paths, and blob digests from the candidate source commit."
  ],
  "resolved_contradictions": [
    "Preserved all previously approved v10 sandbox, authority, budget, runtime binding, provider-isolation, and worker-outbox publication-priority decisions.",
    "Rejected the v12 proposal to repair materialization by manually deleting two additional test IDs from capability evidence.",
    "Classified both worker-outbox publication-priority regressions under machine_readable_result_bundle in the authoritative fixed registry.",
    "Replaced hand-maintained blueprint evidence inventories with deterministic registry resolution bound to candidate commit 9ff06d8 while retaining concrete evidence in the frozen taskpack.",
    "Kept legacy concrete-evidence blueprints compatible and preserved strict runtime equality checks against the fixed registry.",
    "Regenerated the Git-installed candidate release, deterministic calibration authority, protocol, and promotion authority for source commit 9ff06d8.",
    "Preserved failed v10 and unmaterialized v11/v12 artifacts as immutable forensic evidence and requires a fresh v13 taskpack, run identity, epoch, and P2-09 authorization."
  ],
  "remaining_escalations": [
    "Operator must review and approve this exact v13 registry-generated-evidence contract before taskpack materialization or any P2-09 provider launch."
  ],
  "notes": "Proposed v13 registry-generation repair contract. Pending approval; it does not authorize taskpack materialization, P2-09 provider access, main merge, or push."
}
