{
  "schema_version": "phase2_contract_review.v1",
  "decision": "pending",
  "reviewer": "pending-operator",
  "reviewed_at": "2026-08-04T14:48:06Z",
  "git_object_format": "sha1",
  "preflight_release_id": "phase2-promotion-v15-bd906e0-git",
  "preflight_release_source_commit": "bd906e06c7fc5d7abf06e0c380093405ee1408dd",
  "plan_sha256": "042f4c0ce1229b2043b8d397b3aa44feb49d128b5a8320ae4496b30425be6e5c",
  "blueprint_sha256": "b4bcc7789522c26561c0e4642a368472dc83ce7bd784921d22c839f4ad4af482",
  "research_authority_sha256": "8dca1748a211b9eaf9df5d392d7d39d755cbe3946a358c11cff2f51c5323d91d",
  "review_schema_sha256": "cbf009b320d583772a62ba569718d1f61e24c0173a8d6f7e1b9c55314629ed9f",
  "contract_decisions_sha256": "2fa902bad7d2bcabc5018420af042ab17347c6cb86afb2d421ded0a0c4477094",
  "schema_inventory_sha256": "c9bc3c1b5396e58f4bf83d1cc08054570795206a845f9c92cf25ff923fdc0c76",
  "approved_architecture_decisions": [
    "Use the reviewed Git-installed runtime release phase2-promotion-v15-bd906e0-git at source commit bd906e06c7fc5d7abf06e0c380093405ee1408dd.",
    "Treat the same Linux user and control-plane account as trusted authority; malicious same-user swap-and-restore during recomputation is outside the threat model.",
    "Fail closed for ordinary authority drift, missing or extra files, symlinks, special files, path escape, size drift, mode drift, and content drift.",
    "Allow host network sharing only for registered real provider launches whose immutable protocol declares provider_access.",
    "Inject only credential-free numeric-loopback HTTP proxy URLs into provider launches; remove all proxy variables from canary probes and trusted evaluator execution.",
    "Do not inherit the outer AGENTTEAM_LAUNCHER_SELECTION when direct or full experiment adapters launch their nested runtime.",
    "Persist the experiment run ID, run-manifest digest, target-path digest, and controller reference in scheduler state so operator stop validates against the real ledger.",
    "Derive a controller-only run's initial integration baseline from the frozen taskpack runtime release source commit unless the caller supplies an explicit baseline.",
    "Stage provider-readable repo and role context plus the provider result file inside the independent attempt workspace before sealing the sandbox source authority, while keeping those files outside the business Git diff.",
    "Give the normal worker outbox one scheduler tick of publication priority after observing a provider terminal, then retain bounded terminal-only orphan recovery on the following tick.",
    "Mount only the selected Codex 0.145.0 binary, bounded authentication file, sanitized configuration, required system runtime paths, DNS files, and TLS certificates.",
    "Bind the live protocol to model gpt-5.6-sol, medium reasoning, a 600000-token global budget, a 7200-second wall-time budget, and one in-flight provider invocation.",
    "Run P2-08 before P2-09 and P2-10, and require exact current epoch-bound operator authorization before P2-09 may launch any provider.",
    "Use the preregistered deterministic L1 taskpack only in agentteam_direct mode and keep it unavailable to agentteam_full mode.",
    "Do not automatically merge to main or push; P2-10 may only create the reviewed finalization child commit after accepted live evidence and full verification.",
    "Keep the P2-08 capability registry strict and fail closed; the approved blueprint declares registry version phase2_readiness_capability_registry.v1 and materialization generates the exact test IDs, Git artifact paths, and blob digests from the candidate source commit.",
    "Bind contract.protocol_sha256 to the canonical JSON digest of the resolved protocol template and reject mismatches during blueprint materialization before freezing or provider authorization.",
    "Do not publish pre-provider or post-integration boundary observations while an experiment attempt remains inflight; retry transient provider-lane lock contention for at most 250 milliseconds while retaining fail-closed denial for a genuinely occupied lane."
  ],
  "resolved_contradictions": [
    "Preserved the accepted fixed-registry generation, canonical protocol binding, sandbox, authority, budget, runtime-binding, provider-isolation, and worker-outbox mechanisms.",
    "Preserved v14 P2-08 as passed forensic evidence with zero provider calls and zero target mutations.",
    "The authorized v14 P2-09 direct-mode attempt encountered a transient scheduler observation lock before durable provider start, published a no-start failed outbox, and was operator-interrupted after checkpoint growth was diagnosed; token usage remained zero.",
    "Rejected both unsafe interpretations of that run: it is neither successful calibration evidence nor authorization reusable by a repaired candidate.",
    "Removed scheduler boundary observations that had no valid transition while work remained inflight and added bounded retry only for the transient lane-busy class.",
    "Retained no-start outbox quarantine until lease expiry, so untrusted mailbox output still cannot substitute for durable provider lifecycle authority.",
    "Regenerated the Git-installed candidate release, deterministic calibration authority, protocol template, and promotion authority against source commit bd906e0.",
    "Requires a fresh v15 taskpack, run identity, gate epoch, and exact P2-09 provider authorization."
  ],
  "remaining_escalations": [
    "Operator must review and approve this exact v15 provider-lane-contention repair contract before taskpack materialization or any new P2-09 provider launch."
  ],
  "notes": "Proposed v15 provider-lane-contention repair contract. Pending approval; it does not authorize taskpack materialization, P2-09 provider access, main merge, or push."
}
