{
  "schema_version": "phase2_contract_review.v1",
  "decision": "approved",
  "reviewer": "liuql",
  "reviewed_at": "2026-07-30T13:43:37+08:00",
  "git_object_format": "sha1",
  "preflight_release_id": "phase2-calibration-b20a586",
  "preflight_release_source_commit": "b20a58659159297f4463367bd9ef74f0f6a7dd06",
  "plan_sha256": "60a7a29154c7ee8180d898d37ade1b7a8a69911b6daf6b86a522e49703537d09",
  "blueprint_sha256": "7be8087bcc41c59cdf4beb96bde74ae2d9e75163192036838827963872a7e364",
  "research_authority_sha256": "8dca1748a211b9eaf9df5d392d7d39d755cbe3946a358c11cff2f51c5323d91d",
  "review_schema_sha256": "cbf009b320d583772a62ba569718d1f61e24c0173a8d6f7e1b9c55314629ed9f",
  "contract_decisions_sha256": "1b8c06bb2be99bff5eed711ab2c8815d0c28de56cd6f5ca4c0ebd73564aeb633",
  "schema_inventory_sha256": "d00ccf4e5254b0e822e34a0fa4433575a44f4dea77cd60f254132f5fedce73f9",
  "approved_architecture_decisions": [
    "Continue from the independently reviewed P2-06R source commit and retain all accepted P2 recovery implementation.",
    "Execute one bounded handoff rebinding task followed by deterministic P2-07A-R calibration and P2-07B-R gate-controller work.",
    "Reuse the committed Phase 2 repository-map handoff instead of paying for another broad repository reread.",
    "Require all calibration evidence to be provider-free, equal-input, all-outcome, cleanup-aware, and projection-rebuildable.",
    "Require every gate relation to be recomputed from current Git and authority evidence rather than trusted declarations.",
    "Require live authorization to remain current, epoch-bound, release-bound, protocol-bound, and single-lane.",
    "Keep P2-08, live calibration, candidate promotion, main-branch merge, and push outside this continuation."
  ],
  "resolved_contradictions": [
    "Treat P2-06R as accepted prior authority rather than replaying a blocked historical scheduler attempt.",
    "Install the reviewed P2-06R runtime as preflight authority before the run while forbidding any post-run candidate activation inside the continuation.",
    "Preserve deterministic test execution while keeping all live provider paths disabled."
  ],
  "remaining_escalations": [],
  "notes": "Derived continuation of the already approved Phase 2 v4 contract. It authorizes P2-07A-R and P2-07B-R on a verified integration baseline only."
}
