{
  "schema_version": "phase2_contract_review.v1",
  "decision": "pending",
  "reviewer": "pending-operator",
  "reviewed_at": "2026-08-04T01:20:00Z",
  "git_object_format": "sha1",
  "preflight_release_id": "phase2-promotion-v12-aed3218",
  "preflight_release_source_commit": "aed321842dcc40147f5c739c7d1778f6752f982b",
  "plan_sha256": "042f4c0ce1229b2043b8d397b3aa44feb49d128b5a8320ae4496b30425be6e5c",
  "blueprint_sha256": "5f2700ef50329c5cf2a2f1d12eef0fa74355fa08febcbf340412603393b5f9d4",
  "research_authority_sha256": "8dca1748a211b9eaf9df5d392d7d39d755cbe3946a358c11cff2f51c5323d91d",
  "review_schema_sha256": "cbf009b320d583772a62ba569718d1f61e24c0173a8d6f7e1b9c55314629ed9f",
  "contract_decisions_sha256": "3bfd777950a40719cfa9d60bca8fe02271442f74cc637033747b04a3516fcb6e",
  "schema_inventory_sha256": "0b836a9c48d4caefa98b0e06b624602ce0464de27c27676d5db3a0502269fae7",
  "approved_architecture_decisions": [
    "Use the reviewed Git-installed runtime release phase2-promotion-v12-aed3218 at source commit aed321842dcc40147f5c739c7d1778f6752f982b.",
    "Treat the same Linux user and control-plane account as trusted authority; malicious same-user swap-and-restore during recomputation is outside the threat model.",
    "Fail closed for ordinary authority drift, missing or extra files, symlinks, special files, path escape, size drift, mode drift, and content drift.",
    "Allow host network sharing only for registered real provider launches whose immutable protocol declares provider_access.",
    "Inject only credential-free numeric-loopback HTTP proxy URLs into provider launches; remove all proxy variables from canary probes and trusted evaluator execution.",
    "Do not inherit the outer AGENTTEAM_LAUNCHER_SELECTION when direct or full experiment adapters launch their nested runtime.",
    "Persist the experiment run ID, run-manifest digest, target-path digest, and controller reference in scheduler state so operator stop validates against the real ledger.",
    "Derive a controller-only run's initial integration baseline from the frozen taskpack runtime release source commit unless the caller supplies an explicit baseline.",
    "Stage provider-readable repo and role context plus the provider result file inside the independent attempt workspace before sealing the sandbox source authority, while keeping those files outside the business Git diff.",
    "Give the normal worker outbox one scheduler tick of publication priority after observing a provider terminal, then retain bounded terminal-only orphan recovery on the following tick.",
    "Mount only the selected Codex 0.145.0 binary, bounded authentication file, sanitized configuration, required system runtime paths, DNS files, and TLS certificates.",
    "Bind the live protocol to model gpt-5.6-sol, medium reasoning, a 600000-token global budget, a 7200-second wall-time budget, and one in-flight provider invocation.",
    "Run P2-08 before P2-09 and P2-10, and require exact current epoch-bound operator authorization before P2-09 may launch any provider.",
    "Use the preregistered deterministic L1 taskpack only in agentteam_direct mode and keep it unavailable to agentteam_full mode.",
    "Do not automatically merge to main or push; P2-10 may only create the reviewed finalization child commit after accepted live evidence and full verification."
  ],
  "resolved_contradictions": [
    "Preserved all previously approved v10 sandbox, authority, budget, runtime binding, and provider-isolation decisions.",
    "Resolved the v10 direct-mode semantic rejection by proving that the provider produced the correct patch and complete outbox, then preventing terminal-only reconciliation from winning the normal outbox publication race.",
    "Kept terminal-only orphan recovery bounded to the following scheduler tick when no worker outbox is published.",
    "Replayed the exact v10 sealed evaluator argv and observed the expected nonzero exit without timeout, so no unsupported evaluator change is included in v12.",
    "Regenerated deterministic calibration evidence against aed3218 instead of reusing v10 runtime identity.",
    "Preserved the failed v10 run and approved-but-unmaterialized v11 contract as immutable forensic evidence.",
    "Resolved the v11 materialization rejection by removing only two additional test IDs from the fixed P2-08 capability registry while retaining those tests and the outbox-priority success criterion.",
    "Requires a fresh v12 taskpack, run identity, epoch, and P2-09 authorization."
  ],
  "remaining_escalations": [
    "Operator must review and approve this exact v12 contract before taskpack materialization or any P2-09 provider launch."
  ],
  "notes": "Proposed v12 materialization repair contract. Pending approval; it does not authorize taskpack materialization, P2-09 provider access, main merge, or push."
}
